reporterSecret,reporterName,targetSecret,targetName,reportText,submittedAt
The Shadow,Haim Assraf,The Hacker,Dana Cohen,He looked suspicious near the vault.,2025-06-10 14:32:00
The Whisperer,Lior Levi,The Fox,Noa Siman-Tov,They were seen exchanging documents.,2025-06-11 09:15:00
The Eye,Eliav Regev,The Snake,Ron Ben-David,There was a strange conversation in code.,2025-06-11 10:45:00
The Coder,Tamar Golan,The Lion,Gadi Peleg,He accessed a secure terminal.,2025-06-11 11:30:00
The Watcher,Maya Azulay,The Falcon,Yossi Mizrahi,They left together late at night.,2025-06-11 12:00:00
